parola,definizione,sillabe,lemma,pronuncia,grammatica,locuzioni,url
u,"[""ventunesima lettera dell'alfabeto, diciannovesima dell'alfabeto scolastico, il cui nome esteso è u; nell'ortografia italiana rappresenta in genere la vocale chiusa velare /u/ uva | luna | fluire | innocuo | turchese | statua; se è collocata prima di una vocale e non è accentata indica generalmente la semiconsonante velare /w/, specie se è preceduta da consonante velare (c, g, q) e seguita da vocale, oppure è all'inizio di parola o in combinazione con i davanti a vocale tonica acquario | buono | causa | lingua | quattro | uomo | uovo | cuoco | fuoco | iniquo | nuoto | quasi | seguente; in finale di parola è sempre accentata"", 'nel codice alfabetico internazionale, la lettera u viene convenzionalmente identificata dal nome uniform', 'nella compitazione telefonica, la lettera u viene convenzionalmente identificata dalla città di Udine U come Udine', ""(specialmente maiuscola) in funzione di aggettivo numerale indica il ventunesimo o il diciannovesimo elemento o livello di una serie ordinata mediante lettere dell'alfabeto classe II sezione U | serie U | turno U | sezione U. | categoria U"", 'PALEOGRAFIA  --  fino ai primi del Cinquecento u rappresentava graficamente anche il suono della consonante fricativa labiodentale sonora v; la distinzione grafica divenne comune alla fine del Seicento']",['u'],"U, u", /ˈu/,['sostantivo maschile e femminile'],"['a U', 'inversione a U', 'valle a U', 'onda U', 'allevamento a U semplice o doppia']",https://www.dizionario-italiano.it/dizionario-italiano.php?parola=u100
uabaio,"[""BOTANICA  --  nome comune di una pianta del genere Acocantera (Acocanthera abyssinica) diffusa nell'Africa sudorientale, dalle cui radici si estrae un latice velenoso utilizzato dagli indigeni per avvelenare le frecce da caccia; un arbusto sempreverde delle Apocinacee, con foglie lucide, fiori bianchi sfumati di rosa, e frutti velenosissimi; anche il nome del veleno stesso""]","['ua', 'ba', 'io']",uabàio, /waˈbajo/,['sostantivo maschile'],[],https://www.dizionario-italiano.it/dizionario-italiano.php?parola=uabaio100
uadi,"[""nome generico dei corsi d'acqua, sempre asciutti fuorché nella stagione delle piogge, caratteristici delle zone desertiche africane""]","['ua', 'di']",uàdi, /ˈwadi/,['sostantivo maschile'],[],https://www.dizionario-italiano.it/dizionario-italiano.php?parola=uadi100
uau,['adattamento italiano di wow'],['uau'],uàu, /ˈwaw/,['interiezione'],[],https://www.dizionario-italiano.it/dizionario-italiano.php?parola=uau100
ubbia,"['pregiudizio, opinione infondata che è causa di timore o avversione ingiustificati']","['ub', 'bi', 'a']",ubbìa, /ubˈbia/,['sostantivo femminile'],[],https://www.dizionario-italiano.it/dizionario-italiano.php?parola=ubbia100
ubbidente,['variante meno comune di ubbidiente'],"['ub', 'bi', 'den', 'te']",ubbidènte, /ubbiˈdɛnte/,['participio presente e aggettivo'],[],https://www.dizionario-italiano.it/dizionario-italiano.php?parola=ubbidente100
ubbidiente,['participio presente di ubbidire nei significati del verbo'],"['ub', 'bi', 'dien', 'te']",ubbidiènte, /ubbiˈdjɛnte/,['participio presente e aggettivo'],"['chi vuol essere ubbidiente non deve strafare in niente', 'il marito deve essere paziente, ma anche la moglie deve essere ubbidiente']",https://www.dizionario-italiano.it/dizionario-italiano.php?parola=ubbidiente100
ubbidienza,"[""l'ubbidire; la virtù il comportamento di chi ubbidisce"", 'la sottomissione dovuta dai religiosi ai loro superiori']","['ub', 'bi', 'dien', 'za']",ubbidiènza, /ubbiˈdjɛntsa/,['sostantivo femminile'],"[""dove comincia il peccato, cessa l'ubbidienza"", ""la perfetta ubbidienza d'ogni bene è semenza"", ""l'ubbidienza è il fondamento dell'ordine"", ""l'ubbidienza è il primo dovere del soldato"", ""l'ubbidienza irragionevole è pazzia"", ""l'ubbidienza per paura, poco dura"", ""l'ubbidienza val più del sacrificio""]",https://www.dizionario-italiano.it/dizionario-italiano.php?parola=ubbidienza100
ubbidire,"[""fare ciò che viene ordinato; sottostare all'altrui volontà"", 'detto di organi fisici o di meccanismi corrispondere a un ordine, a un comando', ""fare ciò che viene ordinato; sottostare all'altrui volontà"", 'detto di organi fisici o di meccanismi corrispondere a un ordine, a un comando']","['ub', 'bi', 'di', 're']",ubbidìre, /ubbiˈdire/,['verbo transitivo e intransitivo'],"['chi non vuol ubbidire ai genitori, ubbidirá al carceriere', 'chi non vuole ubbidire al padre in giovinezza, va a pericolo di ubbidire al boia in vecchiezza', ""dall'ubbidire deve cominciare, chi vuol esser adatto a comandare"", 'è meglio ubbidire, che santificare', ""il ferro stesso, ch'è si' duro e saldo, ubbidisce al martel quand'è ben caldo"", 'l’intelletto deve governare, e la volontà ubbidire', ""l'intelletto deve governare, e la volontà ubbidire"", 'se tu vuoi ubbidire, non fare più di quello che ti vien comandato']",https://www.dizionario-italiano.it/dizionario-italiano.php?parola=ubbidire100
ubbidito,['participio passato di ubbidire nei significati del verbo comandi ubbiditi | leggi ubbidite'],"['ub', 'bi', 'di', 'to']",ubbidìto, /ubbiˈdito/,['participio passato e aggettivo'],[],https://www.dizionario-italiano.it/dizionario-italiano.php?parola=ubbidito100
ubbioso,['pieno di ubbie'],"['ub', 'bio', 'so']",ubbióso," /ubˈbjoso/, /ubˈbjozo/",['aggettivo'],[],https://www.dizionario-italiano.it/dizionario-italiano.php?parola=ubbioso100
ubbriaco,['variante rara di ubriaco'],"['ub', 'bri', 'a', 'co']",ubbriàco, /ubbriˈako/,['aggettivo e sostantivo maschile'],[],https://www.dizionario-italiano.it/dizionario-italiano.php?parola=ubbriaco100
ubere,"[""LETTERARIO  --  fertile, fecondo, ubertoso, verdeggiante; copioso Biella tra 'l monte e il verdeggiar de' piani / lieta guardante l'ubere convalle [Carducci]""]","['u', 'be', 're']",ùbere, /ˈubere/,['aggettivo'],[],https://www.dizionario-italiano.it/dizionario-italiano.php?parola=ubere100
ubero,"[""LETTERARIO  --  mammella il vecchio padre mio / il gregge m'insegnava di conducere, / e di tonsar le lane e munger gli uberi [Sannazzaro] | in vista al monte nevoso / che ha forma di ubero pieno [D'Annunzio]""]","['u', 'be', 'ro']",ùbero, /ˈubero/,['sostantivo maschile'],[],https://www.dizionario-italiano.it/dizionario-italiano.php?parola=ubero100
uberta,"[""letterario detto di terreno l'essere fertile, fecondo""]","['u', 'ber', 'ta']",ubertà, /uberˈta/,['sostantivo femminile'],[],https://www.dizionario-italiano.it/dizionario-italiano.php?parola=uberta100
ubertosita,"[""RARO  --  carattere, proprietà, condizione di ciò che è ubertoso; fertilità, abbondante capacità produttiva ubertosità d'un terreno | ubertosità di una regione | ubertosità di una valle | l'ubertosità della nostra pianura""]","['u', 'ber', 'to', 'si', 'ta']",ubertosità, /ubertosiˈta/,['sostantivo femminile'],[],https://www.dizionario-italiano.it/dizionario-italiano.php?parola=ubertosita100
ubertoso,"['fertile, fecondo']","['u', 'ber', 'to', 'so']",ubertóso," /uberˈtoso/, /uberˈtozo/",['aggettivo'],[],https://www.dizionario-italiano.it/dizionario-italiano.php?parola=ubertoso100
ubi,"[""LETTERARIO VOCE LATINA  --   luogo, sito io sentiva osannar di coro in coro / al punto fisso che li tiene a li ubi [Dante] | io l'ho visto / là 've s'appunta ogne ubi e ogne quando [Dante] | la parte / ubi la prim'ombra gitta il santo monte [Dante]"", 'Unione Bocciofila Italiana', 'Unione Buddista Italiana']","['u', 'bi']",ùbi, /ˈubi/,"['sostantivo maschile', 'sigla']",['ubi consistam'],https://www.dizionario-italiano.it/dizionario-italiano.php?parola=ubi100
ubicare,"['situare, porre in un luogo']","['u', 'bi', 'ca', 're']",ubicàre, /ubiˈkare/,['verbo transitivo'],[],https://www.dizionario-italiano.it/dizionario-italiano.php?parola=ubicare100
ubicato,"['participio passato di ubicare nei significati del verbo', 'posto, situato, collocato una casa male ubicata']","['u', 'bi', 'ca', 'to']",ubicàto, /ubiˈkato/,['participio passato e aggettivo'],[],https://www.dizionario-italiano.it/dizionario-italiano.php?parola=ubicato100
ubicazione,"['il luogo in cui è situato un edificio, un fondo e simili']","['u', 'bi', 'ca', 'zio', 'ne']",ubicazióne, /ubikatˈtsjone/,['sostantivo femminile'],[],https://www.dizionario-italiano.it/dizionario-italiano.php?parola=ubicazione100
ubiquista,"['ECCLESIASTICO  --  lo stesso, ma meno comune, che ubiquitario', 'ECOLOGIA  --  detto di specie animale o vegetale, non legata a un determinato aggruppamento o paesaggio, diffusa ovunque; cosmopolita']","['u', 'bi', 'qui', 'sta']",ubiquìsta, /ubiˈkwista/,['agg. e s. maschile e femminile'],[],https://www.dizionario-italiano.it/dizionario-italiano.php?parola=ubiquista100
ubiquita,"[""l'essere contemporaneamente presente in ogni luogo""]","['u', 'bi', 'qui', 'ta']",ubiquità, /ubikwiˈta/,['sostantivo femminile'],[],https://www.dizionario-italiano.it/dizionario-italiano.php?parola=ubiquita100
ubiquitario,['presente in ogni luogo'],"['u', 'bi', 'qui', 'ta', 'rio']",ubiquitàrio, /ubikwiˈtarjo/,['aggettivo e sostantivo maschile'],[],https://www.dizionario-italiano.it/dizionario-italiano.php?parola=ubiquitario100
ubriacamento,"[""RARO  --  l'ubriacarsi; ubriacatura"", 'PER ESTENSIONE  --  stordimento']","['u', 'bri', 'a', 'ca', 'men', 'to']",ubriacaménto, /ubriakaˈmento/,['sostantivo maschile'],[],https://www.dizionario-italiano.it/dizionario-italiano.php?parola=ubriacamento100
ubriacare,"['rendere ubriaco', 'in senso figurato stordire; esaltare fino ad offuscare il giudizio', 'bere alcolici fino a diventare ubriaco, sbronzarsi, prendere una sbornia tutte le feste va a ubriacarsi | tutte le sere si ubriaca | se non smetti di ubriacarti finirai alcolizzato | quando si ubriaca ha la sbornia triste | fa il giro delle osterie e si ubriaca', 'FIGURATO  --  inebriarsi, eccitarsi ubriacarsi di gloria | ubriacarsi di felicità | ubriacarsi di film sciocchi | ubriacarsi di musica']","['u', 'bri', 'a', 'ca', 're']",ubriacàre, /ubriaˈkare/,"['verbo transitivo', 'verbo pronominale intransitivo']","['ubriacarsi di una donna di un uomo', 'ubriacarsi di luce di sole', 'ubriacarsi di sangue', 'il vino in casa non ubriaca', ""l'ultimo bicchiere non ubriaca"", 'vino in casa non ubriaca']",https://www.dizionario-italiano.it/dizionario-italiano.php?parola=ubriacare100
ubriacato,['participio passato di ubriacare nei significati del verbo'],"['u', 'bri', 'a', 'ca', 'to']",ubriacàto, /ubriaˈkato/,['participio passato e aggettivo'],[],https://www.dizionario-italiano.it/dizionario-italiano.php?parola=ubriacato100
ubriacatura,"[""l'ubriacarsi, l'essere ubriaco anche in senso figurato""]","['u', 'bri', 'a', 'ca', 'tu', 'ra']",ubriacatùra, /ubriakaˈtura/,['sostantivo femminile'],"[""l'ubriacatura non è colpa del vino, ma di chi lo beve"", ""l'ubriacatura rivela ciò che è nascosto"", ""quando l'ubriacatura è passata, sopraggiunge il pentimento"", 'una buona ubriacatura, nove giorni dura']",https://www.dizionario-italiano.it/dizionario-italiano.php?parola=ubriacatura100
ubriachezza,['lo stato di chi è ubriaco; il vizio di ubriacarsi'],"['u', 'bri', 'a', 'chez', 'za']",ubriachézza, /ubriaˈkettsa/,['sostantivo femminile'],"[""l'eccesso della gioia divien tristezza e l'eccesso del vin ubriachezza""]",https://www.dizionario-italiano.it/dizionario-italiano.php?parola=ubriachezza100
ubriaco,"[""di persona che si trova in stato di alterazione mentale a causa di un'intossicazione da alcol"", 'fuori di sé, eccitato', 'stordito']","['u', 'bri', 'a', 'co']",ubriàco, /ubriˈako/,['aggettivo e sostantivo maschile'],"['andatura da ubriaco', 'chi pecca ubriaco, fa penitenza digiuno', 'chi va a letto ubriaco, si alza invecchiato', 'di quello che fai da ubriaco te ne penti da sobrio', 'Dio aiuta tre sorte di gente: i pazzi, i bimbi e gli ubriachi', 'gente ubriaca, vede doppio', ""la mattina dopo, l'ubriaco giura sempre di diventare sobrio"", 'la vista di un ubriaco è la miglior lezione di sobrietà', 'mai litigare con gli ubriachi', 'non puoi avere botte piena e moglie ubriaca', 'non si può avere la botte piena e la moglie ubriaca', 'quando il principe è brillo, il popolo è ubriaco', ""quando l'ubriaco dorme, non bisogna svegliarlo"", ""quel che il sobrio ha nel cuore, l'ubriaco ha sulla lingua"", 'una notte ubriaca fa un mattino nuvoloso', 'volere la botte piena e la moglie ubriaca']",https://www.dizionario-italiano.it/dizionario-italiano.php?parola=ubriaco100
ubriacone,"['accrescitivo di ubriaco', 'chi si ubriaca abitualmente, beone']","['u', 'bri', 'a', 'co', 'ne']",ubriacóne, /ubriaˈkone/,['sostantivo maschile'],[],https://www.dizionario-italiano.it/dizionario-italiano.php?parola=ubriacone100
uccellaccio,"['spregiativo di uccello', 'ARCAICO  --  uccello rapace, che si nutre di carogne o di piccoli mammiferi se non fia chi me lo vieti, / farò di lui mille uccellacci lieti [Ariosto]', 'FIGURATO  --  chi pronostica disgrazie e porta perciò sfortuna', 'ARCAICO  --  persona semplice e sciocca, balordo, gonzo, scioccone']","['uc', 'cel', 'lac', 'cio']",uccellàccio, /utʧelˈlatʧo/,['sostantivo maschile'],"['uccellaccio del malaugurio, di cattivo augurio']",https://www.dizionario-italiano.it/dizionario-italiano.php?parola=uccellaccio100
uccellagione,"[""l'uccellare; anche gli uccelli presi a caccia""]","['uc', 'cel', 'la', 'gio', 'ne']",uccellagióne, /utʧellaˈʤone/,['sostantivo femminile'],[],https://www.dizionario-italiano.it/dizionario-italiano.php?parola=uccellagione100
uccellaia,['luogo o installazione per la cattura degli uccelli'],"['uc', 'cel', 'la', 'ia']",uccellàia, /utʧelˈlaja/,['sostantivo femminile'],[],https://www.dizionario-italiano.it/dizionario-italiano.php?parola=uccellaia100
uccellaio,"['CACCIA RARO  --   chi vende uccelli vivi, da tenere in gabbia o da usare come richiamo']","['uc', 'cel', 'la', 'io']",uccellàio, /utʧelˈlajo/,['sostantivo maschile'],[],https://www.dizionario-italiano.it/dizionario-italiano.php?parola=uccellaio100
uccellanda,['appostamento fisso per la cattura degli uccelli'],"['uc', 'cel', 'lan', 'da']",uccellànda, /utʧelˈlanda/,['sostantivo femminile'],[],https://www.dizionario-italiano.it/dizionario-italiano.php?parola=uccellanda100
uccellare,"['CACCIA ARCAICO  --   appostamento per la cattura di uccelli vivi, costituito da reti, panie, richiami, ecc.; uccellanda partitomi del bosco, io me ne vo ad una fonte, e di quivi in un mio uccellare Machiavelli | allettamenti coi quali sono tratti alle reti e alle panie, negli uccellari e paretai Leopardi', ""CACCIA  -- (AVERE) andare a caccia di uccelli, con reti, trappole, panie, richiami e simili, e in genere con sistemi che non comportino l'uso delle armi uccellare ai tordi | uccellare ai fringuelli | uccellare alle allodole | uccellare col falcone | andare a uccellare | questa è la stagione di uccellare | in niuna altra cosa il suo tempo spendeva che in uccellare e in cacciare [Boccaccio]"", ""FIGURATO ARCAICO  -- (AVERE)  cercare di ottenere qualcosa con ogni mezzo, specialmente con trucchi e inganni uccellare a cariche | uccellare a stipendi | uccellare a guadagni | uccellare agli onori | l'inganno: non invidiava, non uccellava le ricchezze altrui Muratori"", 'ARCAICO  -- (AVERE) amoreggiare', 'LETTERARIO  --  ingannare, con insidie e lusinghe, beffare, gabbare, raggirare li quali spesse volte, mentre altrui si credono uccellare, dopo il fatto sé da altrui essere stati uccellati conoscono [Boccaccio] | gli uomini che lusingano le ragazze da marito, e quelle pettegole le quali stanno alla finestra ad uccellarli [Verga]']","['uc', 'cel', 'la', 're']",uccellàre, /utʧelˈlare/,"['sostantivo maschile', 'verbo intransitivo', 'verbo transitivo']","['non uccellare a pispole', 'uccellare alle cime', 'chi va per uccellar, resta impaniato', ""sul più bello dell'uccellare muore la civetta""]",https://www.dizionario-italiano.it/dizionario-italiano.php?parola=uccellare100
uccellato,"['participio passato di uccellare nei significati del verbo', 'FIGURATO ARCAICO  --   beffato, burlato, ingannato rimanere uccellato', 'TESSITURA ARCAICO  --   detto di tessuto, specialmente di lino, dipinto od operato con figure di uccelli', 'seta uccellata', 'tessuto uccellato']","['uc', 'cel', 'la', 'to']",uccellàto, /utʧelˈlato/,"['participio passato e aggettivo', 'aggettivo e sostantivo maschile']",[],https://www.dizionario-italiano.it/dizionario-italiano.php?parola=uccellato100
uccellatoio,"['CACCIA  --  lo stesso, ma meno comune, che uccellanda', 'toponimo di un poggio a nord di Firenze, a poca distanza da Pratolino, ricordato da Dante nel canto XV del Paradiso non era vinto ancora Montemalo / dal vostro Uccellatoio [Dante]']","['uc', 'cel', 'la', 'to', 'io']",uccellatóio, /utʧellaˈtojo/,"['sostantivo maschile', 'nome proprio maschile']","[""mandare qualcuno all'uccellatoio""]",https://www.dizionario-italiano.it/dizionario-italiano.php?parola=uccellatoio100
uccellatore,['chi pratica la caccia agli uccelli per prenderli vivi'],"['uc', 'cel', 'la', 'to', 're']",uccellatóre, /utʧellaˈtore/,['sostantivo maschile'],[],https://www.dizionario-italiano.it/dizionario-italiano.php?parola=uccellatore100
uccelletto,"['diminutivo di uccello', ""uccello di piccola taglia, svelto e grazioso, con valore vezzeggiativo quivi s'odono gli uccelletti cantare [Boccaccio]"", '(specialmente al plurale) piccolo uccello, specialmente come cacciagione uccelletti allo spiedo | uccelletti con la polenta']","['uc', 'cel', 'let', 'to']",uccellétto, /utʧelˈletto/,['sostantivo maschile'],"['uccelli, uccelletti, uccellini scappati', ""all'uccelletto"", 'uccelletti scappati']",https://www.dizionario-italiano.it/dizionario-italiano.php?parola=uccelletto100
uccelliera,['luogo chiuso o grande gabbia in cui si tengono uccelli'],"['uc', 'cel', 'lie', 'ra']",uccellièra, /utʧelˈljɛra/,['sostantivo femminile'],[],https://www.dizionario-italiano.it/dizionario-italiano.php?parola=uccelliera100
uccellina,"['MARINERIA  --  nome generico di tutte le vele volanti, ma in special modo gli stralli e stralletti degli alberi di velaccio e controvelaccio', ""MARINERIA  --  sulle imbarcazioni a vela da diporto, fiocco volante alzato molto in alto sullo strallo, usato in crociera perché consente una migliore visibilità verso prua rispetto ai fiocchi normali; se l'inferitura è molto lunga, è chiamato anche yankee"", 'MARINERIA  --  lo stesso, ma meno comune, che gabbiola']","['uc', 'cel', 'li', 'na']",uccellìna, /utʧelˈlina/,['sostantivo femminile'],[],https://www.dizionario-italiano.it/dizionario-italiano.php?parola=uccellina100
uccellino,"['ARCAICO  --  di uccello', 'diminutivo di uccello', 'uccello di piccola mole, o appena nato o non ancora atto al volo una nidiata di uccellini | gli uccellini pigolavano nel nido | un nido pieno di uccellini', 'CACCIA GASTRONOMIA  --   uccello di piccole dimensioni, specialmente in quanto cacciagione uccellini al tegame | uccellini allo spiedo | tenere gli uccellini in gabbia | guardar volare gli uccellini | catturare gli uccellini con la pania | li occhi per la fronda verde / ficcava ïo sì come far suole / chi dietro a li uccellin sua vita perde [Dante]']","['uc', 'cel', 'li', 'no']",uccellìno, /utʧelˈlino/,"['aggettivo', 'sostantivo maschile']","['uccelli, uccelletti, uccellini scappati', 'uccellini scappati', 'uccello, uccellino scappato', 'uccellini scappati', 'tanto caca un bue, quanto un uccellino']",https://www.dizionario-italiano.it/dizionario-italiano.php?parola=uccellino100
